"1","1","AO-001","Áo thun cotton basic cổ tròn","ao-thun-cotton-basic-co-tron","Áo thun cotton 2 chiều mềm mịn, thấm hút tốt, form regular dễ phối đồ đi học đi làm.","250g","70x50x2 cm","Cotton 100%","Trắng,Đen,Xám","189000","149000","120","Basic"
"2","1","AO-002","Áo thun oversize unisex in chữ","ao-thun-oversize-unisex-in-chu","Áo thun oversize unisex, vải cotton dày dặn, in chữ bền màu, phù hợp streetwear.","320g","72x56x2 cm","Cotton 260gsm","Đen,Trắng,Xanh navy","229000","199000","80","Streetwear"
"3","1","AO-003","Áo polo piqué phối bo tay","ao-polo-pique-phoi-bo-tay","Áo polo vải piqué thoáng khí, cổ đứng form lịch sự, hợp đi làm và đi chơi.","280g","71x52x2 cm","Piqué (Cotton blend)","Xanh navy,Trắng,Be","279000","239000","65","Smart casual"
"4","1","AO-004","Áo sơ mi oxford tay dài","ao-so-mi-oxford-tay-dai","Sơ mi oxford dệt chắc, ít nhăn, dễ ủi, phù hợp công sở và gặp gỡ.","350g","74x54x2 cm","Oxford cotton","Xanh nhạt,Trắng,Xám","359000","319000","55","Công sở"
"5","1","AO-005","Áo sơ mi linen ngắn tay","ao-so-mi-linen-ngan-tay","Sơ mi linen mát nhẹ, thấm hút, phong cách tối giản, hợp mùa nóng Việt Nam.","300g","72x53x2 cm","Linen pha","Be,Trắng,Xanh rêu","329000","279000","70","Tối giản"
"6","1","AO-006","Áo croptop gân ôm dáng","ao-croptop-gan-om-dang","Croptop vải gân co giãn, ôm dáng tôn form, phù hợp phối quần cạp cao.","180g","45x38x2 cm","Thun gân co giãn","Hồng pastel,Trắng,Đen","159000","","95","Nữ tính"
"7","1","AO-007","Áo hai dây satin cổ đổ","ao-hai-day-satin-co-do","Áo hai dây satin nhẹ mát, cổ đổ sang, hợp phối blazer hoặc chân váy.","160g","42x36x1 cm","Satin","Kem,Đen,Hồng pastel","199000","169000","60","Thanh lịch"
"8","1","AO-008","Áo len mỏng cổ lọ basic","ao-len-mong-co-lo-basic","Áo len mỏng cổ lọ, giữ ấm vừa phải, phù hợp thời tiết se lạnh, dễ layer.","290g","60x45x3 cm","Len acrylic","Nâu,Kem,Đen","259000","219000","40","Basic"
"9","2","QUAN-001","Quần jean slim fit xanh đậm","quan-jean-slim-fit-xanh-dam","Jean co giãn nhẹ, ôm vừa phải, tôn dáng, dễ phối áo thun và sơ mi.","520g","100x38x3 cm","Denim co giãn","Xanh đậm,Đen,Xám đậm","459000","399000","75","Casual"
"10","2","QUAN-002","Quần jean ống rộng cạp cao","quan-jean-ong-rong-cap-cao","Jean ống rộng cạp cao, che khuyết điểm, phong cách Hàn Quốc.","560g","102x40x3 cm","Denim","Xanh nhạt,Xanh đậm,Đen","489000","439000","55","Hàn Quốc"
"11","2","QUAN-003","Quần kaki straight fit màu be","quan-kaki-straight-fit-mau-be","Kaki đứng form, ít nhăn, hợp đi làm, phối giày sneaker hoặc loafer.","480g","101x39x3 cm","Kaki","Be,Đen,Xanh rêu","399000","349000","60","Công sở"
"12","2","QUAN-004","Quần âu xếp ly form suông","quan-au-xep-ly-form-suong","Quần âu xếp ly, form suông hiện đại, phù hợp công sở và sự kiện.","430g","102x39x3 cm","Tuytsi","Đen,Xám,Nâu","499000","449000","45","Thanh lịch"
"13","2","QUAN-005","Quần jogger nỉ bo gấu","quan-jogger-ni-bo-gau","Jogger nỉ dày vừa, bo gấu gọn gàng, mặc đi chơi, tập nhẹ.","450g","98x37x3 cm","Nỉ bông","Xám,Đen,Xanh navy","279000","239000","90","Sport"
"14","2","QUAN-006","Quần short kaki 5 inch","quan-short-kaki-5-inch","Short kaki 5 inch, gọn mát, phù hợp du lịch, phối áo polo.","260g","50x35x2 cm","Kaki","Xanh rêu,Be,Đen","249000","","110","Năng động"
"15","2","QUAN-007","Quần legging thể thao cạp cao","quan-legging-the-thao-cap-cao","Legging co giãn 4 chiều, cạp cao ôm bụng, phù hợp tập gym yoga.","240g","92x30x2 cm","Poly spandex","Đen,Xám,Tím than","219000","189000","85","Thể thao"
"16","2","QUAN-008","Quần culottes vải tuyết mưa","quan-culottes-vai-tuyet-mua","Culottes vải tuyết mưa rũ nhẹ, không bám bụi, lịch sự mà thoải mái.","390g","88x42x2 cm","Tuyết mưa","Kem,Đen,Nâu","369000","319000","50","Office casual"
"17","3","VAY-001","Váy suông công sở cổ tim","vay-suong-cong-so-co-tim","Váy suông cổ tim thanh lịch, che khuyết điểm, phù hợp môi trường công sở.","360g","95x45x2 cm","Tuytsi","Đen,Xanh navy,Be","459000","399000","45","Công sở"
"18","3","VAY-002","Đầm hoa nhí tay bồng","dam-hoa-nhi-tay-bong","Đầm hoa nhí tay bồng nhẹ, tôn dáng, phong cách nữ tính đi dạo phố.","320g","98x46x2 cm","Voan lót","Vàng hoa,Hồng hoa,Xanh hoa","429000","369000","55","Nữ tính"
"19","3","VAY-003","Đầm body gân ôm dáng","dam-body-gan-om-dang","Đầm body gân co giãn, ôm dáng tôn đường cong, hợp đi tiệc nhẹ.","310g","92x40x2 cm","Thun gân","Đỏ đô,Đen,Nâu","359000","299000","40","Sexy"
"20","3","VAY-004","Váy chữ A cạp cao","vay-chu-a-cap-cao","Váy chữ A cạp cao, dễ phối áo sơ mi hoặc áo thun, phù hợp đi làm đi chơi.","250g","65x38x2 cm","Kate","Xanh navy,Đen,Be","289000","249000","70","Basic"
"21","3","VAY-005","Chân váy midi xếp ly","chan-vay-midi-xep-ly","Chân váy midi xếp ly rũ đẹp, chuyển động mềm mại, hợp phong cách thanh lịch.","280g","80x40x2 cm","Poly","Nâu,Kem,Đen","339000","299000","60","Thanh lịch"
"22","3","VAY-006","Đầm maxi đi biển cổ yếm","dam-maxi-di-bien-co-yem","Đầm maxi cổ yếm, chất liệu mát nhẹ, phù hợp đi biển, chụp ảnh đẹp.","390g","130x48x2 cm","Chiffon","Trắng,Vàng nhạt,Xanh biển","499000","449000","35","Resort"
"23","3","VAY-007","Váy denim chữ A cúc trước","vay-denim-chu-a-cuc-truoc","Váy denim chữ A, cúc trước trẻ trung, dễ phối áo thun basic.","370g","68x39x2 cm","Denim","Xanh denim,Xanh đậm,Đen","369000","","50","Casual"
"24","3","VAY-008","Đầm blazer dáng ngắn","dam-blazer-dang-ngan","Đầm blazer dáng ngắn, vai đứng form, phù hợp sự kiện, lên đồ sang trọng.","420g","88x44x2 cm","Tuytsi cao cấp","Đen,Trắng,Kem","599000","549000","25","Sang trọng"
"25","4","AOKHOAC-001","Áo khoác gió chống nước nhẹ","ao-khoac-gio-chong-nuoc-nhe","Áo khoác gió chống nước nhẹ, có mũ, phù hợp đi mưa lất phất, đi xe máy.","420g","72x56x3 cm","Poly chống nước","Xanh navy,Đen,Xám","459000","399000","55","Outdoor"
"26","4","AOKHOAC-002","Áo hoodie nỉ basic unisex","ao-hoodie-ni-basic-unisex","Hoodie nỉ bông ấm áp, form rộng vừa, dễ phối đồ streetwear.","600g","74x58x4 cm","Nỉ bông","Xám,Đen,Trắng kem","399000","349000","80","Streetwear"
"27","4","AOKHOAC-003","Áo cardigan len nút gỗ","ao-cardigan-len-nut-go","Cardigan len mềm, nút gỗ vintage, phù hợp phối váy hoặc quần jean.","430g","68x50x3 cm","Len acrylic","Be,Nâu,Kem","379000","319000","45","Vintage"
"28","4","AOKHOAC-004","Áo blazer công sở 1 nút","ao-blazer-cong-so-1-nut","Blazer 1 nút, form chuẩn công sở, tôn dáng, phù hợp đi làm, gặp khách.","520g","72x52x3 cm","Tuytsi","Đen,Xám,Be","699000","629000","30","Công sở"
"29","4","AOKHOAC-005","Áo khoác jean wash xanh","ao-khoac-jean-wash-xanh","Áo khoác jean wash, chất denim dày vừa, phong cách cá tính.","650g","70x54x4 cm","Denim","Xanh wash,Xanh đậm,Đen","529000","479000","40","Casual"
"30","4","AOKHOAC-006","Áo khoác bomber dù nhẹ","ao-khoac-bomber-du-nhe","Bomber dù nhẹ, giữ ấm vừa phải, phong cách năng động, hợp đi tối.","470g","68x55x3 cm","Dù nylon","Đen,Xanh rêu,Xám","469000","419000","50","Năng động"
"31","4","AOKHOAC-007","Áo khoác dạ mỏng cổ ve","ao-khoac-da-mong-co-ve","Áo khoác dạ mỏng cổ ve, lịch sự, phù hợp thời tiết se lạnh miền Bắc.","780g","95x54x4 cm","Dạ pha","Nâu,Đen,Be","799000","729000","20","Thanh lịch"
"32","4","AOKHOAC-008","Áo khoác nỉ zip hoodie","ao-khoac-ni-zip-hoodie","Áo khoác nỉ kéo khóa, tiện mặc nhiều lớp, phù hợp đi học đi làm.","520g","70x56x4 cm","Nỉ da cá","Xanh rêu,Xám,Đen","349000","","65","Basic"
"33","5","PHUKIEN-001","Nón lưỡi trai thêu chữ","non-luoi-trai-theu-chu","Nón lưỡi trai thêu chữ, form cứng vừa, dễ phối đồ unisex.","120g","28x20x12 cm","Cotton canvas","Đen,Trắng,Be","149000","129000","150","Streetwear"
"34","5","PHUKIEN-002","Thắt lưng da bò mặt khóa kim","that-lung-da-bo-mat-khoa-kim","Thắt lưng da bò thật, khóa kim chắc chắn, phù hợp quần jean và quần âu.","180g","120x3x1 cm","Da bò","Nâu,Đen","259000","229000","90","Công sở"
"35","5","PHUKIEN-003","Túi đeo chéo mini chống nước","tui-deo-cheo-mini-chong-nuoc","Túi đeo chéo mini chống nước, nhiều ngăn, phù hợp đi chơi, du lịch.","260g","22x16x7 cm","Poly chống nước","Đen,Xám,Xanh navy","219000","199000","110","Năng động"
"36","5","PHUKIEN-004","Vớ cổ cao thể thao 3 đôi","vo-co-cao-the-thao-3-doi","Set 3 đôi vớ cổ cao, thấm hút tốt, co giãn, phù hợp sneaker.","90g","20x10x4 cm","Cotton blend","Trắng,Đen,Xám","99000","","200","Thể thao"
"37","5","PHUKIEN-005","Kính mát gọng vuông","kinh-mat-gong-vuong","Kính mát gọng vuông, chống tia UV, phù hợp phong cách Hàn Quốc.","70g","15x5x4 cm","Nhựa acetate","Đen,Nâu trà,Trong suốt","199000","169000","70","Hàn Quốc"
"38","5","PHUKIEN-006","Ví da mini cầm tay","vi-da-mini-cam-tay","Ví da mini nhỏ gọn, nhiều ngăn thẻ, phù hợp mang theo hằng ngày.","140g","12x9x3 cm","Da PU","Nâu,Đen,Be","229000","199000","85","Tối giản"
"39","5","PHUKIEN-007","Túi tote canvas in hình","tui-tote-canvas-in-hinh","Túi tote canvas dày, in hình dễ thương, đựng sách hoặc laptop nhẹ.","220g","35x32x8 cm","Canvas","Kem,Đen,Nâu","179000","149000","120","Casual"
"40","5","PHUKIEN-008","Khăn choàng lụa họa tiết","khan-choang-lua-hoa-tiet","Khăn choàng lụa mềm mát, họa tiết sang, dùng đi làm hoặc dự tiệc.","80g","180x70x1 cm","Lụa satin","Xanh ngọc,Hồng phấn,Kem","189000","159000","60","Thanh lịch"
